{
  "schemaVersion": 1,
  "warehouse": {
    "code": "WH-A",
    "name": "Two-way warehouse with a central cross-aisle",
    "lengthM": 40,
    "widthM": 32,
    "heightM": 9,
    "origin": { "x": 0, "z": 0 },
    "metadata": {
      "note": "3 aisles x 2 lanes x 10 bays x 5 levels, with one 2-bay cross-aisle through every lane"
    }
  },
  "rackTypes": [
    {
      "id": "rt-std",
      "code": "STD",
      "name": "Standard pallet rack",
      "bayWidthM": 2.7,
      "depthM": 1.1,
      "uprightWidthM": 0.12,
      "uprightDepthM": 0.12
    }
  ],
  "obstacles": [
    {
      "id": "col-1",
      "kind": "COLUMN",
      "x": 6,
      "z": 11.2,
      "widthM": 0.6,
      "depthM": 0.6,
      "heightM": 6
    },
    {
      "id": "col-2",
      "kind": "COLUMN",
      "x": 16,
      "z": 11.2,
      "widthM": 0.6,
      "depthM": 0.6,
      "heightM": 6
    },
    {
      "id": "col-3",
      "kind": "COLUMN",
      "x": 26,
      "z": 11.2,
      "widthM": 0.6,
      "depthM": 0.6,
      "heightM": 6
    },
    {
      "id": "pil-1",
      "kind": "PILLAR",
      "x": 10,
      "z": 28.5,
      "widthM": 0.8,
      "depthM": 0.8,
      "heightM": 9
    },
    {
      "id": "office-1",
      "kind": "OFFICE",
      "x": 33,
      "z": 24,
      "widthM": 6,
      "depthM": 5,
      "heightM": 3.5
    }
  ],
  "aisles": [
    {
      "id": "a-1",
      "code": "A01",
      "orientation": "X",
      "centerline": { "x1": 4, "z1": 7.5, "x2": 31, "z2": 7.5 },
      "widthM": 3.4,
      "travelDirection": "BOTH",
      "lanes": [
        {
          "id": "a-1-l",
          "code": "A01-L",
          "side": "LEFT",
          "rackTypeId": "rt-std",
          "startOffsetM": 0,
          "lengthM": 27,
          "metadata": { "skuClass": "A", "pickFace": true },
          "levels": [
            { "clearHeightM": 1.4, "binDepthM": 1, "beamHeightM": 0.08, "maxWeightKg": 800 },
            { "clearHeightM": 1.4, "binDepthM": 1, "beamHeightM": 0.08, "maxWeightKg": 800 },
            { "clearHeightM": 1.4, "binDepthM": 1, "beamHeightM": 0.08, "maxWeightKg": 800 },
            { "clearHeightM": 1.4, "binDepthM": 1, "beamHeightM": 0.08, "maxWeightKg": 800 },
            { "clearHeightM": 1.4, "binDepthM": 1, "beamHeightM": 0.08, "maxWeightKg": 800 }
          ],
          "segments": [
            { "kind": "RACK", "startM": 0, "endM": 10.8, "label": "front" },
            { "kind": "GAP", "startM": 10.8, "endM": 16.2, "label": "cross-aisle" },
            { "kind": "RACK", "startM": 16.2, "endM": 27, "label": "back" }
          ]
        },
        {
          "id": "a-1-r",
          "code": "A01-R",
          "side": "RIGHT",
          "rackTypeId": "rt-std",
          "startOffsetM": 0,
          "lengthM": 27,
          "levels": [
            { "clearHeightM": 1.4, "binDepthM": 1, "beamHeightM": 0.08, "maxWeightKg": 800 },
            { "clearHeightM": 1.4, "binDepthM": 1, "beamHeightM": 0.08, "maxWeightKg": 800 },
            { "clearHeightM": 1.4, "binDepthM": 1, "beamHeightM": 0.08, "maxWeightKg": 800 },
            { "clearHeightM": 1.4, "binDepthM": 1, "beamHeightM": 0.08, "maxWeightKg": 800 },
            { "clearHeightM": 1.4, "binDepthM": 1, "beamHeightM": 0.08, "maxWeightKg": 800 }
          ],
          "segments": [
            { "kind": "RACK", "startM": 0, "endM": 10.8, "label": "front" },
            { "kind": "GAP", "startM": 10.8, "endM": 16.2, "label": "cross-aisle" },
            { "kind": "RACK", "startM": 16.2, "endM": 27, "label": "back" }
          ]
        }
      ]
    },
    {
      "id": "a-2",
      "code": "A02",
      "orientation": "X",
      "centerline": { "x1": 4, "z1": 15.5, "x2": 31, "z2": 15.5 },
      "widthM": 3.4,
      "travelDirection": "BOTH",
      "lanes": [
        {
          "id": "a-2-l",
          "code": "A02-L",
          "side": "LEFT",
          "rackTypeId": "rt-std",
          "startOffsetM": 0,
          "lengthM": 27,
          "levels": [
            { "clearHeightM": 1.4, "binDepthM": 1, "beamHeightM": 0.08, "maxWeightKg": 800 },
            { "clearHeightM": 1.4, "binDepthM": 1, "beamHeightM": 0.08, "maxWeightKg": 800 },
            { "clearHeightM": 1.4, "binDepthM": 1, "beamHeightM": 0.08, "maxWeightKg": 800 },
            { "clearHeightM": 1.4, "binDepthM": 1, "beamHeightM": 0.08, "maxWeightKg": 800 },
            { "clearHeightM": 1.4, "binDepthM": 1, "beamHeightM": 0.08, "maxWeightKg": 800 }
          ],
          "segments": [
            { "kind": "RACK", "startM": 0, "endM": 10.8, "label": "front" },
            { "kind": "GAP", "startM": 10.8, "endM": 16.2, "label": "cross-aisle" },
            { "kind": "RACK", "startM": 16.2, "endM": 27, "label": "back" }
          ]
        },
        {
          "id": "a-2-r",
          "code": "A02-R",
          "side": "RIGHT",
          "rackTypeId": "rt-std",
          "startOffsetM": 0,
          "lengthM": 27,
          "levels": [
            { "clearHeightM": 1.4, "binDepthM": 1, "beamHeightM": 0.08, "maxWeightKg": 800 },
            { "clearHeightM": 1.4, "binDepthM": 1, "beamHeightM": 0.08, "maxWeightKg": 800 },
            { "clearHeightM": 1.4, "binDepthM": 1, "beamHeightM": 0.08, "maxWeightKg": 800 },
            { "clearHeightM": 1.4, "binDepthM": 1, "beamHeightM": 0.08, "maxWeightKg": 800 },
            { "clearHeightM": 1.4, "binDepthM": 1, "beamHeightM": 0.08, "maxWeightKg": 800 }
          ],
          "segments": [
            { "kind": "RACK", "startM": 0, "endM": 10.8, "label": "front" },
            { "kind": "GAP", "startM": 10.8, "endM": 16.2, "label": "cross-aisle" },
            { "kind": "RACK", "startM": 16.2, "endM": 27, "label": "back" }
          ]
        }
      ]
    },
    {
      "id": "a-3",
      "code": "A03",
      "orientation": "X",
      "centerline": { "x1": 4, "z1": 23.5, "x2": 31, "z2": 23.5 },
      "widthM": 3.4,
      "travelDirection": "BOTH",
      "lanes": [
        {
          "id": "a-3-l",
          "code": "A03-L",
          "side": "LEFT",
          "rackTypeId": "rt-std",
          "startOffsetM": 0,
          "lengthM": 27,
          "levels": [
            { "clearHeightM": 1.4, "binDepthM": 1, "beamHeightM": 0.08, "maxWeightKg": 800 },
            { "clearHeightM": 1.4, "binDepthM": 1, "beamHeightM": 0.08, "maxWeightKg": 800 },
            { "clearHeightM": 1.4, "binDepthM": 1, "beamHeightM": 0.08, "maxWeightKg": 800 },
            { "clearHeightM": 1.4, "binDepthM": 1, "beamHeightM": 0.08, "maxWeightKg": 800 },
            { "clearHeightM": 1.4, "binDepthM": 1, "beamHeightM": 0.08, "maxWeightKg": 800 }
          ],
          "segments": [
            { "kind": "RACK", "startM": 0, "endM": 10.8, "label": "front" },
            { "kind": "GAP", "startM": 10.8, "endM": 16.2, "label": "cross-aisle" },
            { "kind": "RACK", "startM": 16.2, "endM": 27, "label": "back" }
          ]
        },
        {
          "id": "a-3-r",
          "code": "A03-R",
          "side": "RIGHT",
          "rackTypeId": "rt-std",
          "startOffsetM": 0,
          "lengthM": 27,
          "levels": [
            { "clearHeightM": 1.4, "binDepthM": 1, "beamHeightM": 0.08, "maxWeightKg": 800 },
            { "clearHeightM": 1.4, "binDepthM": 1, "beamHeightM": 0.08, "maxWeightKg": 800 },
            { "clearHeightM": 1.4, "binDepthM": 1, "beamHeightM": 0.08, "maxWeightKg": 800 },
            { "clearHeightM": 1.4, "binDepthM": 1, "beamHeightM": 0.08, "maxWeightKg": 800 },
            { "clearHeightM": 1.4, "binDepthM": 1, "beamHeightM": 0.08, "maxWeightKg": 800 }
          ],
          "segments": [
            { "kind": "RACK", "startM": 0, "endM": 10.8, "label": "front" },
            { "kind": "GAP", "startM": 10.8, "endM": 16.2, "label": "cross-aisle" },
            { "kind": "RACK", "startM": 16.2, "endM": 27, "label": "back" }
          ]
        }
      ]
    }
  ]
}
